{
  "schemaVersion": 2,
  "indexVersion": 22,
  "runner": {
    "path": "lib/runner.js",
    "sha256": "cba0212f03a70f3ab5c1be9da7228f2a27c253822ff941e178d7750bbac20072"
  },
  "families": [
    {
      "id": "chaoxing-jw",
      "metadata": {
        "path": "families/chaoxing-jw/family.json",
        "sha256": "ae6687f02c4114a96a793a0b813b0ed31dc5cb3514f593665eaa668a81012ee9"
      },
      "adapter": {
        "path": "families/chaoxing-jw/adapter.js",
        "sha256": "4734189ad8f1c06f541ceb303033d2baca7bbb2ffd52ced2734aac67b1b0f067"
      }
    },
    {
      "id": "eams-urp",
      "metadata": {
        "path": "families/eams-urp/family.json",
        "sha256": "0bf7c1b8fab00a9f4e9ec83332424d2aff449cdc7fea2141ce927303797defc0"
      },
      "adapter": {
        "path": "families/eams-urp/adapter.js",
        "sha256": "baa218f4544834bd7f390ef18f70bfece190a68f9dac5b6051822410007bc99d"
      }
    },
    {
      "id": "example-portal",
      "metadata": {
        "path": "families/example-portal/family.json",
        "sha256": "96174965cdcd43a3f39aa81542cc266ed3673b505faf56d466491e7e316fcf96"
      },
      "adapter": {
        "path": "families/example-portal/adapter.js",
        "sha256": "1bc98fc64344d643983b866c2de9bdf9bec2e87c42504c129751aca7966f3614"
      }
    },
    {
      "id": "generic-table",
      "metadata": {
        "path": "families/generic-table/family.json",
        "sha256": "c360d92e566f76a52e2ad75082b4b6da98fa33d16a5541d9fb4ed789e0970309"
      },
      "adapter": {
        "path": "families/generic-table/adapter.js",
        "sha256": "608cc9e0896b2fd86534f29425d246dff951282ede2c9c2f5c3535166007383c"
      }
    },
    {
      "id": "jwapp",
      "metadata": {
        "path": "families/jwapp/family.json",
        "sha256": "2bf02ff4ce66c34a518df8b137965d30c39fdd61215af279a7f59835c4f01b78"
      },
      "adapter": {
        "path": "families/jwapp/adapter.js",
        "sha256": "6224f1ae2455cc3294ec5a282e21d693ab096c0fed2c03fe6a5adde352f2d63c"
      }
    },
    {
      "id": "qiangzhi-jsxsd",
      "metadata": {
        "path": "families/qiangzhi-jsxsd/family.json",
        "sha256": "f9c3dbfa45c2dbe83d4d09747e014613e9c1ade35e12c2da396f1bccbbedfbfc"
      },
      "adapter": {
        "path": "families/qiangzhi-jsxsd/adapter.js",
        "sha256": "c6bbf415de53cb6e2ba1c8083ad62eb2fbc02cc4ef40c3d99d1111cb0bb1de1b"
      }
    },
    {
      "id": "zhengfang-v9",
      "metadata": {
        "path": "families/zhengfang-v9/family.json",
        "sha256": "93213233d034f8247fa33cf72e11bbc4ddeb014eafdaadb1b64b48de9d65a732"
      },
      "adapter": {
        "path": "families/zhengfang-v9/adapter.js",
        "sha256": "ca7336c10c0f01c15d55be712fa520d303355c97cbc20b5d32a3b07e40c3688c"
      }
    }
  ],
  "schools": [
    {
      "id": "ahu",
      "name": "安徽大学",
      "aliases": [
        "安大",
        "Anhui University",
        "AHU"
      ]
    },
    {
      "id": "bfsu",
      "name": "北京外国语大学",
      "aliases": [
        "北外",
        "Beijing Foreign Studies University",
        "BFSU"
      ]
    },
    {
      "id": "bit",
      "name": "北京理工大学",
      "aliases": [
        "北理工",
        "Beijing Institute of Technology",
        "BIT"
      ]
    },
    {
      "id": "bjfu",
      "name": "北京林业大学",
      "aliases": [
        "北林",
        "Beijing Forestry University",
        "BJFU"
      ]
    },
    {
      "id": "bjtu",
      "name": "北京交通大学",
      "aliases": [
        "北交大",
        "Beijing Jiaotong University",
        "BJTU"
      ]
    },
    {
      "id": "bjut",
      "name": "北京工业大学",
      "aliases": [
        "北工大",
        "Beijing University of Technology",
        "BJUT"
      ]
    },
    {
      "id": "bnu",
      "name": "北京师范大学",
      "aliases": [
        "北师大",
        "Beijing Normal University",
        "BNU"
      ]
    },
    {
      "id": "bsu",
      "name": "北京体育大学",
      "aliases": [
        "北体",
        "Beijing Sport University",
        "BSU"
      ]
    },
    {
      "id": "buaa",
      "name": "北京航空航天大学",
      "aliases": [
        "北航",
        "Beihang University",
        "BUAA"
      ]
    },
    {
      "id": "bucm",
      "name": "北京中医药大学",
      "aliases": [
        "北中医",
        "Beijing University of Chinese Medicine",
        "BUCM"
      ]
    },
    {
      "id": "buct",
      "name": "北京化工大学",
      "aliases": [
        "北化",
        "Beijing University of Chemical Technology",
        "BUCT"
      ]
    },
    {
      "id": "bupt",
      "name": "北京邮电大学",
      "aliases": [
        "北邮",
        "Beijing University of Posts and Telecommunications",
        "BUPT"
      ]
    },
    {
      "id": "cau",
      "name": "中国农业大学",
      "aliases": [
        "中国农大",
        "China Agricultural University",
        "CAU"
      ]
    },
    {
      "id": "ccnu",
      "name": "华中师范大学",
      "aliases": [
        "华中师大",
        "Central China Normal University",
        "CCNU"
      ]
    },
    {
      "id": "ccom",
      "name": "中央音乐学院",
      "aliases": [
        "央音",
        "Central Conservatory of Music",
        "CCOM"
      ]
    },
    {
      "id": "chd",
      "name": "长安大学",
      "aliases": [
        "长大",
        "Chang'an University",
        "CHD"
      ]
    },
    {
      "id": "cpu",
      "name": "中国药科大学",
      "aliases": [
        "药大",
        "China Pharmaceutical University",
        "CPU"
      ]
    },
    {
      "id": "cqu",
      "name": "重庆大学",
      "aliases": [
        "重大",
        "Chongqing University",
        "CQU"
      ]
    },
    {
      "id": "csu",
      "name": "中南大学",
      "aliases": [
        "中南",
        "Central South University",
        "CSU"
      ]
    },
    {
      "id": "cuc",
      "name": "中国传媒大学",
      "aliases": [
        "中传",
        "Communication University of China",
        "CUC"
      ]
    },
    {
      "id": "cufe",
      "name": "中央财经大学",
      "aliases": [
        "央财",
        "Central University of Finance and Economics",
        "CUFE"
      ]
    },
    {
      "id": "cug",
      "name": "中国地质大学（武汉）",
      "aliases": [
        "地大",
        "China University of Geosciences, Wuhan",
        "CUG"
      ]
    },
    {
      "id": "cug-beijing",
      "name": "中国地质大学（北京）",
      "aliases": [
        "地大北京",
        "China University of Geosciences, Beijing",
        "CUGB"
      ]
    },
    {
      "id": "cumt",
      "name": "中国矿业大学",
      "aliases": [
        "矿大",
        "China University of Mining and Technology",
        "CUMT"
      ]
    },
    {
      "id": "cumtb",
      "name": "中国矿业大学（北京）",
      "aliases": [
        "矿大北京",
        "China University of Mining and Technology, Beijing",
        "CUMTB"
      ]
    },
    {
      "id": "cup-beijing",
      "name": "中国石油大学（北京）",
      "aliases": [
        "石大北京",
        "China University of Petroleum, Beijing",
        "CUP"
      ]
    },
    {
      "id": "cupl",
      "name": "中国政法大学",
      "aliases": [
        "法大",
        "China University of Political Science and Law",
        "CUPL"
      ]
    },
    {
      "id": "dhu",
      "name": "东华大学",
      "aliases": [
        "东华",
        "Donghua University",
        "DHU"
      ]
    },
    {
      "id": "dlmu",
      "name": "大连海事大学",
      "aliases": [
        "海大",
        "Dalian Maritime University",
        "DLMU"
      ]
    },
    {
      "id": "dlut",
      "name": "大连理工大学",
      "aliases": [
        "大工",
        "Dalian University of Technology",
        "DLUT"
      ]
    },
    {
      "id": "ecnu",
      "name": "华东师范大学",
      "aliases": [
        "华师大",
        "East China Normal University",
        "ECNU"
      ]
    },
    {
      "id": "ecust",
      "name": "华东理工大学",
      "aliases": [
        "华理",
        "East China University of Science and Technology",
        "ECUST"
      ]
    },
    {
      "id": "fmmu",
      "name": "空军军医大学",
      "aliases": [
        "第四军医大学",
        "空军军医大",
        "Air Force Medical University",
        "FMMU"
      ]
    },
    {
      "id": "fudan",
      "name": "复旦大学",
      "aliases": [
        "复旦",
        "Fudan University"
      ]
    },
    {
      "id": "fzu",
      "name": "福州大学",
      "aliases": [
        "福大",
        "Fuzhou University",
        "FZU"
      ]
    },
    {
      "id": "gxu",
      "name": "广西大学",
      "aliases": [
        "西大",
        "Guangxi University",
        "GXU"
      ]
    },
    {
      "id": "gzu",
      "name": "贵州大学",
      "aliases": [
        "贵大",
        "Guizhou University",
        "GZU"
      ]
    },
    {
      "id": "hainanu",
      "name": "海南大学",
      "aliases": [
        "海大",
        "Hainan University"
      ]
    },
    {
      "id": "hebut",
      "name": "河北工业大学",
      "aliases": [
        "河工大",
        "Hebei University of Technology",
        "HEBUT"
      ]
    },
    {
      "id": "hfut",
      "name": "合肥工业大学",
      "aliases": [
        "合工大",
        "Hefei University of Technology",
        "HFUT"
      ]
    },
    {
      "id": "hhu",
      "name": "河海大学",
      "aliases": [
        "河海",
        "Hohai University",
        "HHU"
      ]
    },
    {
      "id": "hit",
      "name": "哈尔滨工业大学",
      "aliases": [
        "哈工大",
        "Harbin Institute of Technology",
        "HIT"
      ]
    },
    {
      "id": "hnu",
      "name": "湖南大学",
      "aliases": [
        "湖大",
        "Hunan University",
        "HNU"
      ]
    },
    {
      "id": "hrbeu",
      "name": "哈尔滨工程大学",
      "aliases": [
        "哈工程",
        "Harbin Engineering University",
        "HRBEU"
      ]
    },
    {
      "id": "hunnu",
      "name": "湖南师范大学",
      "aliases": [
        "湖南师大",
        "Hunan Normal University",
        "HUNNU"
      ]
    },
    {
      "id": "hust",
      "name": "华中科技大学",
      "aliases": [
        "华科",
        "Huazhong University of Science and Technology",
        "HUST"
      ]
    },
    {
      "id": "hzau",
      "name": "华中农业大学",
      "aliases": [
        "华农",